Agency Name,Website,City,State,Services,Notable Clients,Contact Page URL,General Contact Email,Phone Number,Partnership Potential Score
Plastix Marketing,https://plastixmarketing.com,Greenville,SC,"SEO, Digital Advertising, Content Marketing, CRM, Practice Consulting",Plastic Surgeons & MedSpas (exclusive niche),https://plastixmarketing.com/contact,hello@plastixmarketing.com,404-737-7673,9
Studio III Marketing,https://studio3marketing.com,Glendale,CA,"Branding, Web Design, SEO, Patient Acquisition",15+ years exclusively serving plastic surgery practices,https://studio3marketing.com/contact,,888-351-3514,9
Influx Marketing,https://influxmarketing.com,Park City,UT,"Custom Website Design, SEO, PPC, Integrated Campaigns",Plastic Surgeons & MedSpas,https://influxmarketing.com/contact,info@influxmarketing.com,888-982-0775,9
Rosemont Media,https://rosemontmedia.com,San Diego,CA,"Custom Website Design, SEO, Digital Marketing for Medical",Plastic Surgeons & Medical Professionals,https://rosemontmedia.com/contact,,858-348-5766,9
Incredible Marketing,https://incrediblemarketing.com,Lake Forest,CA,"Website Design, SEO, Content Marketing, Social Media",Plastic Surgery & MedSpa Practices,https://incrediblemarketing.com/contact,IM@IncredibleMarketing.com,800-949-0133,9
NKP Medical Marketing,https://nkpmedical.com,Manhattan Beach,CA,"Website Design, SEO, PPC, Social Media, Reputation Management, Chat Solutions",Plastic Surgeons & Dermatologists & MedSpas,https://nkpmedical.com/contact,info@nkpmedical.com,866-539-2201,9
GrowthMed,https://growthmed.com,Playa Del Rey,CA,"Website Design, Technical SEO, Patient Acquisition",Plastic Surgery & Medical Aesthetic Practices,https://growthmed.com/contact,,310-577-0000,8
Thrive Internet Marketing Agency,https://thriveagency.com,Arlington,TX,"SEO, Social Media, Web Development, Content Marketing, PPC",Healthcare & MedSpa Clients,https://thriveagency.com/contact,sales@thriveagency.com,866-908-4748,8
PilotPractice,https://pilotpractice.com,Tempe,AZ,"SEO, PPC, Web Design, Social Media, CRM, AI Follow-ups",Plastic Surgeons Nationwide,https://pilotpractice.com/contact,marketing@pilotpractice.com,480-605-1837,8
ClinicGrower,https://clinicgrower.com,Tampa,FL,"SEO, Lead Generation, Team Coaching, Patient Coordinator Training",Medical & Aesthetic Practices,https://clinicgrower.com/contact,info@clinicgrower.com,813-603-3106,8
Plastic Surgery Studios,https://plasticsurgerystudios.com,Rancho Cucamonga,CA,"SEO, Custom Web Design (20+ years in niche)",Plastic Surgeons (exclusive focus),https://plasticsurgerystudios.com/contact,,909-758-8300,9
ARSNL Media,https://arsnlmedia.com,Miami Lakes,FL,"Paid Advertising, Influencer Marketing, SEO, MedSpa Marketing",MedSpas & Aesthetic Clinics (South Florida),https://arsnlmedia.com/contact,,954-603-1520,7
Dagmar Marketing,https://dagmarmarketing.com,Jacksonville,FL,"SEO, PPC, Web Design",Medical & Healthcare Practices,https://dagmarmarketing.com/contact,,904-270-9778,7
PBHS (RevenueWell),https://pbhs.com,Santa Rosa,CA,"Website Design, SEO, PPC, Social Media, Patient Education",Plastic Surgeons & Dermatologists & MedSpas,https://pbhs.com/contact,,855-415-9355,8
Intrepy Healthcare Marketing,https://intrepy.com,Atlanta,GA,"Med Spa Website Design, SEO, Paid Advertising, Patient Acquisition",MedSpas & Surgical Practices,https://intrepy.com/contact,,770-462-4237,8
MDLogica,https://mdlogica.com,Beverly Hills,CA,"Website Design, SEO, Practice Marketing",Plastic Surgery & Dermatology & MedSpas,https://mdlogica.com/contact,hello@mdlogica.com,310-777-1230,8
True North Social,https://truenorthsocial.com,Culver City,CA,"Social Media, Web Design, SEO, Content",Plastic Surgery & Cosmetic Clinics,https://truenorthsocial.com/contact,sales@truenorthsocial.com,310-694-5655,7
MRKTMADE,https://mrktmade.com,Los Angeles,CA,"Branding, Storytelling, Aesthetic Practice Marketing",Plastic Surgery & Aesthetic Practices (boutique),https://mrktmade.com/contact,talk@mrktmade.com,213-378-1591,8
eMaximize,https://emaximize.com,Manhattan Beach,CA,"SEO, PPC, Web Design, ROI-Driven Medical Marketing",Medical Practices,https://emaximize.com/contact,info@emaximize.com,310-706-4051,7
First Page Sage,https://firstpagesage.com,San Francisco,CA,"SEO, Generative Engine Optimization (GEO), B2B Lead Generation",Healthcare Providers,https://firstpagesage.com/contact-us,,855-888-7243,7
Pennock,https://pennock.co,Remote,NY,"Paid Social, Google Ads, Performance Marketing",Beauty & Skincare & Aesthetics Brands,https://pennock.co/contact,,—,7
MedStar Media,https://medstarmedia.com,South Jordan,UT,"Digital Marketing, Lead Generation, Patient Acquisition",Medical Spas & Aesthetic Providers,https://medstarmedia.com/contact,support@medstarmedia.com,801-890-3847,7
PatientGain,https://patientgain.com,Los Altos,CA,"Website Platform, SEO, Lead Tracking, HIPAA Apps",Medical Practices & MedSpas,https://patientgain.com/contact,sales@patientgain.com,—,7
Veooz,https://veooz.com,Remote,FL,"SEO, Custom Web Development, Lead Generation",Plastic Surgeons (Florida focus),https://veooz.com/contact,,—,6
GrowthMarketing Studios,https://growthmarketingstudios.com,Miami,FL,"AI-Powered SEO, Google Ads, Automated Patient Acquisition",Plastic Surgery Clinics (Miami focus),https://growthmarketingstudios.com/contact,,—,7
Dr. SEO,https://drseo.io,Tampa,FL,"Medical SEO, Digital Advertising, Reputation Management",Cosmetic Surgery & Dental Practices,https://drseo.io/contact,GrowYourBusiness@DrSEO.io,800-288-1358,7
MDConsultingNY,https://mdconsultingny.com,New York,NY,"SEO, Advertising, Social Media, Web Design, Lead Generation",Medical Aesthetics & Wellness Practices,https://mdconsultingny.com/contact,,—,8
Sperduti Communications,https://sperduticommunications.com,Phoenix,AZ,"Branding, Web Development, Marketing (Women-Owned)",Medical & Aesthetic Practices (AZ),https://sperduticommunications.com/contact,info@sperduticommunications.com,480-215-8408,7
PrimeView,https://primeview.com,Phoenix,AZ,"Web Design, SEO, PPC, Social Media",MedSpas & Local Businesses,https://primeview.com/contact,support@primeview.com,480-970-4688,6
Lesser Media,https://lessermedia.com,Remote,NV,"Aesthetic Spa SEO, Video Marketing, Instagram, Lead Generation",MedSpas & Integrative Medicine,https://lessermedia.com/contact,info@lessermedia.com,352-585-8857,6
Wise Roots LLC,https://wiserootsllc.com,Scottsdale,AZ,"Google Ads, Meta Ads, Geofencing, Local SEO",MedSpas (Phoenix/Scottsdale),https://wiserootsllc.com/contact,,—,6
Orange Carrot Media,https://orangecarrotmedia.com,West Palm Beach,FL,"SEO, Paid Media, Intake Automation, Healthcare Marketing",Medical Spas & Healthcare,https://orangecarrotmedia.com/contact,,561-603-9344,7
VT Wyatt,https://vtwyatt.com,Remote,TX,"Unified Growth System, Competitive Intelligence, Revenue Attribution",Medical Spas & Aesthetic Practices,https://vtwyatt.com/contact,,—,7
Brenton Way,https://brentonway.com,Los Angeles,CA,"Growth Marketing, SEO, Paid Media, Content",Medical & Aesthetics Brands,https://brentonway.com/contact,sales@brentonway.com,424-208-2521,7
Just Digital Inc,https://justdigitalinc.com,Pasadena,CA,"MedSpa Web Design, SEO, Digital Marketing",MedSpas & Aesthetic Clinics,https://justdigitalinc.com/contact,info@justdigitalinc.com,424-210-7128,7
WebTonic,https://webtonic.io,San Francisco,CA,"Growth Marketing, SEO, Paid Advertising",Health & Wellness Businesses,https://webtonic.io/contact,sf@webtonic.io,866-547-2701,6
Lasso Up,https://lasso-up.com,Remote,TX,"SEO, PPC, Inbound Marketing, Email Automation, AI Content",MedSpas & Local Businesses,https://lasso-up.com/contact,,—,6
Target Patients MD,https://targetpatientsmd.com,Remote,FL,"Patient Acquisition, AI Targeting, SEO, Paid Advertising",MedSpas & Plastic Surgery,https://targetpatientsmd.com/contact,,—,7
Wellness Clinic Marketing,https://wellnessclinicmarketing.com,Miami,FL,"SEO, MARS System, Clinic Marketing",Aesthetic & Wellness Clinics,https://wellnessclinicmarketing.com/contact,,—,6
Heyday Marketing,https://heydaymarketing.com,Miami,FL,"Digital Marketing, SEO, Social Media",Healthcare & MedSpa Brands,https://heydaymarketing.com/contact,,—,6
The Med Spa Agency,https://themedspaagency.com,Remote,CA,"Full-Service MedSpa Marketing, Branding, Social Media",MedSpas (exclusive niche),https://themedspaagency.com/contact,,—,7
MedSpaMarketing.com,https://medspamarketing.com,Remote,NY,"MedSpa SEO, PPC, Lead Generation",Medical Spas (exclusive niche),https://medspamarketing.com/contact,,—,7
Toopixels,https://toopixels.com,Remote,CA,"Web Design, SEO, PPC for Medical Practices",Aesthetic & Medical Clinics,https://toopixels.com/contact,,—,6
Arbrea Labs,https://arbrea-labs.com,Remote,CA,"AR/AI Visualization, Patient Engagement Tech, Marketing Support",Plastic Surgeons (Technology Focus),https://arbrea-labs.com/contact,,—,6
SEO For Growth,https://seoforgrowth.com,Remote,TX,"SEO Strategy, Consulting, B2B Marketing",Healthcare Providers,https://seoforgrowth.com/contact,,—,5
Zeely AI,https://zeely.ai,Remote,CA,"AI Marketing Platform, Lead Gen, Social Selling",Small Businesses & MedSpas,https://zeely.ai/contact,,—,5
360 Clinic Consulting,https://360clinicconsulting.com,Miami,FL,"Clinic Consulting, Marketing Strategy, Revenue Growth",Aesthetic Clinics & MedSpas,https://360clinicconsulting.com/contact,,—,6
Digital Piloto,https://digitalpiloto.com,Remote,NY,"SEO, Web Design, Digital Marketing",Medical & Healthcare Practices,https://digitalpiloto.com/contact,,—,5
Specialist Practice Excellence,https://specialistpracticeexcellence.com,Remote,TX,"Practice Marketing, Growth Strategy, Lead Generation",Cosmetic Surgery & Aesthetic Practices,https://specialistpracticeexcellence.com/contact,,—,6
HeyDay Digital Media,https://heydaydigitalmedia.com,Rocklin,CA,"Digital Marketing, SEO, Social Media",Health & Wellness Brands,https://heydaydigitalmedia.com/contact,Info@heydaydigitalmedia.com,949-390-9494,5
